{
  "schema": "lucky-star-psp.rgo-eboot-vwf-profile.v1",
  "profileId": "rgo-uljm05752-russian-vwf-v1",
  "game": "RyououGakuenOutousaiPortable",
  "discId": "ULJM05752",
  "input": {
    "kind": "decrypted-elf32-mips",
    "size": 1470173,
    "sha256": "3e6c1c2f7136a69cecda4f39835c3454b739e23e89e862fe17462cdf915581d8"
  },
  "fullOutput": {
    "size": 1470173,
    "sha256": "0a2ce9212c3335e17fad28d457b0caf7f25bc1b046707e0da994ee8437f7244f"
  },
  "scriptSizeTable": {
    "offset": 1061278,
    "offsetHex": "0x0010319E",
    "firstId": 0,
    "lastIdInclusive": 10,
    "canonicalBytesHex": "6C046C046E00DA043E0018053E0056053E0094053E00D2053E0010063E004E063E008C063E00CA063E000807"
  },
  "scriptHeap": {
    "luiOffset": 88916,
    "luiOffsetHex": "0x00015B54",
    "addiuOffset": 88920,
    "addiuOffsetHex": "0x00015B58",
    "originalCapacityBytes": 2318336,
    "originalCapacityHex": "0x00236000",
    "originalLuiInstruction": 1006895139,
    "originalLuiInstructionHex": "0x3C040023",
    "originalAddiuInstruction": 612655104,
    "originalAddiuInstructionHex": "0x24846000",
    "policy": "max-original-or-largest-script"
  },
  "groups": [
    {
      "id": "vwf-core",
      "description": "Variable-width glyph rendering core.",
      "patchCount": 66
    },
    {
      "id": "message-layout",
      "description": "Message box spacing, overlap, positioning, and automatic-newline adjustments.",
      "patchCount": 7
    },
    {
      "id": "speaker-layout",
      "description": "Speaker centering and expanded speaker-name capacity.",
      "patchCount": 50
    },
    {
      "id": "choice-layout",
      "description": "Expanded and left-aligned choice text.",
      "patchCount": 3
    },
    {
      "id": "name-layout",
      "description": "Player-name spacing and file-select name handling.",
      "patchCount": 7
    }
  ],
  "patches": [
    {
      "group": "vwf-core",
      "name": "vwf-core-00",
      "offset": 154840,
      "offsetHex": "0x00025CD8",
      "expected": 10504229,
      "expectedHex": "0x00A04825",
      "replacement": 1007159680,
      "replacementHex": "0x3C080980"
    },
    {
      "group": "vwf-core",
      "name": "vwf-core-01",
      "offset": 154844,
      "offsetHex": "0x00025CDC",
      "expected": 8398885,
      "expectedHex": "0x00802825",
      "replacement": 2366207968,
      "replacementHex": "0x8D0977E0"
    },
    {
      "group": "vwf-core",
      "name": "vwf-core-02",
      "offset": 154848,
      "offsetHex": "0x00025CE0",
      "expected": 406528,
      "expectedHex": "0x00063400",
      "replacement": 2902816736,
      "replacementHex": "0xAD0577E0"
    },
    {
      "group": "vwf-core",
      "name": "vwf-core-03",
      "offset": 154852,
      "offsetHex": "0x00025CE4",
      "expected": 467968,
      "expectedHex": "0x00072400",
      "replacement": 11094051,
      "replacementHex": "0x00A94823"
    },
    {
      "group": "vwf-core",
      "name": "vwf-core-04",
      "offset": 154856,
      "offsetHex": "0x00025CE8",
      "expected": 408579,
      "expectedHex": "0x00063C03",
      "replacement": 757661706,
      "replacementHex": "0x2D29000A"
    },
    {
      "group": "vwf-core",
      "name": "vwf-core-05",
      "offset": 154860,
      "offsetHex": "0x00025CEC",
      "expected": 271363,
      "expectedHex": "0x00042403",
      "replacement": 287309828,
      "replacementHex": "0x11200004"
    },
    {
      "group": "vwf-core",
      "name": "vwf-core-06",
      "offset": 154864,
      "offsetHex": "0x00025CF0",
      "expected": 822608127,
      "expectedHex": "0x310800FF",
      "replacement": 0,
      "replacementHex": "0x00000000"
    },
    {
      "group": "vwf-core",
      "name": "vwf-core-07",
      "offset": 154868,
      "offsetHex": "0x00025CF4",
      "expected": 352321621,
      "expectedHex": "0x15000055",
      "replacement": 2365945828,
      "replacementHex": "0x8D0577E4"
    },
    {
      "group": "vwf-core",
      "name": "vwf-core-08",
      "offset": 154872,
      "offsetHex": "0x00025CF8",
      "expected": 18886693,
      "expectedHex": "0x01203025",
      "replacement": 268435459,
      "replacementHex": "0x10000003"
    },
    {
      "group": "vwf-core",
      "name": "vwf-core-09",
      "offset": 154876,
      "offsetHex": "0x00025CFC",
      "expected": 15155233,
      "expectedHex": "0x00E74021",
      "replacement": 0,
      "replacementHex": "0x00000000"
    },
    {
      "group": "vwf-core",
      "name": "vwf-core-10",
      "offset": 154880,
      "offsetHex": "0x00025D00",
      "expected": 15218721,
      "expectedHex": "0x00E83821",
      "replacement": 2902816740,
      "replacementHex": "0xAD0577E4"
    },
    {
      "group": "vwf-core",
      "name": "vwf-core-11",
      "offset": 154884,
      "offsetHex": "0x00025D04",
      "expected": 820510719,
      "expectedHex": "0x30E7FFFF",
      "replacement": 2701162472,
      "replacementHex": "0xA10077E8"
    },
    {
      "group": "vwf-core",
      "name": "vwf-core-12",
      "offset": 154888,
      "offsetHex": "0x00025D08",
      "expected": 485632,
      "expectedHex": "0x00076900",
      "replacement": 281018370,
      "replacementHex": "0x10C00002"
    },
    {
      "group": "vwf-core",
      "name": "vwf-core-13",
      "offset": 154892,
      "offsetHex": "0x00025D0C",
      "expected": 833486847,
      "expectedHex": "0x31ADFFFF",
      "replacement": 0,
      "replacementHex": "0x00000000"
    },
    {
      "group": "vwf-core",
      "name": "vwf-core-14",
      "offset": 154896,
      "offsetHex": "0x00025D10",
      "expected": 873201664,
      "expectedHex": "0x340C0000",
      "replacement": 872808451,
      "replacementHex": "0x34060003"
    },
    {
      "group": "vwf-core",
      "name": "vwf-core-15",
      "offset": 154900,
      "offsetHex": "0x00025D14",
      "expected": 2426994688,
      "expectedHex": "0x90A90000",
      "replacement": 2156593242,
      "replacementHex": "0x808B005A"
    },
    {
      "group": "vwf-core",
      "name": "vwf-core-16",
      "offset": 154904,
      "offsetHex": "0x00025D18",
      "expected": 872611840,
      "expectedHex": "0x34030000",
      "replacement": 10510369,
      "replacementHex": "0x00A06021"
    },
    {
      "group": "vwf-core",
      "name": "vwf-core-17",
      "offset": 154908,
      "offsetHex": "0x00025D1C",
      "expected": 824770563,
      "expectedHex": "0x31290003",
      "replacement": 873267200,
      "replacementHex": "0x340D0000"
    },
    {
      "group": "vwf-core",
      "name": "vwf-core-18",
      "offset": 154912,
      "offsetHex": "0x00025D20",
      "expected": 2428633088,
      "expectedHex": "0x90C20000",
      "replacement": 873332736,
      "replacementHex": "0x340E0000"
    },
    {
      "group": "vwf-core",
      "name": "vwf-core-19",
      "offset": 154916,
      "offsetHex": "0x00025D24",
      "expected": 824770559,
      "expectedHex": "0x3128FFFF",
      "replacement": 2433316840,
      "replacementHex": "0x910977E8"
    },
    {
      "group": "vwf-core",
      "name": "vwf-core-20",
      "offset": 154920,
      "offsetHex": "0x00025D28",
      "expected": 617218049,
      "expectedHex": "0x24CA0001",
      "replacement": 948355,
      "replacementHex": "0x000E7883"
    },
    {
      "group": "vwf-core",
      "name": "vwf-core-21",
      "offset": 154924,
      "offsetHex": "0x00025D2C",
      "expected": 615186433,
      "expectedHex": "0x24AB0001",
      "replacement": 31750177,
      "replacementHex": "0x01E47821"
    },
    {
      "group": "vwf-core",
      "name": "vwf-core-22",
      "offset": 154928,
      "offsetHex": "0x00025D30",
      "expected": 16805925,
      "expectedHex": "0x01007025",
      "replacement": 2448359424,
      "replacementHex": "0x91EF0000"
    },
    {
      "group": "vwf-core",
      "name": "vwf-core-23",
      "offset": 154932,
      "offsetHex": "0x00025D34",
      "expected": 872939520,
      "expectedHex": "0x34080000",
      "replacement": 836239363,
      "replacementHex": "0x31D80003"
    },
    {
      "group": "vwf-core",
      "name": "vwf-core-24",
      "offset": 154936,
      "offsetHex": "0x00025D38",
      "expected": 1438646273,
      "expectedHex": "0x55C00001",
      "replacement": 318767109,
      "replacementHex": "0x13000005"
    },
    {
      "group": "vwf-core",
      "name": "vwf-core-25",
      "offset": 154940,
      "offsetHex": "0x00025D3C",
      "expected": 19349537,
      "expectedHex": "0x01274021",
      "replacement": 0,
      "replacementHex": "0x00000000"
    },
    {
      "group": "vwf-core",
      "name": "vwf-core-26",
      "offset": 154944,
      "offsetHex": "0x00025D40",
      "expected": 4735013,
      "expectedHex": "0x00484025",
      "replacement": 1013891,
      "replacementHex": "0x000F7883"
    },
    {
      "group": "vwf-core",
      "name": "vwf-core-27",
      "offset": 154948,
      "offsetHex": "0x00025D44",
      "expected": 2697461760,
      "expectedHex": "0xA0C80000",
      "replacement": 655949823,
      "replacementHex": "0x2718FFFF"
    },
    {
      "group": "vwf-core",
      "name": "vwf-core-28",
      "offset": 154952,
      "offsetHex": "0x00025D48",
      "expected": 2426929152,
      "expectedHex": "0x90A80000",
      "replacement": 268500987,
      "replacementHex": "0x1000FFFB"
    },
    {
      "group": "vwf-core",
      "name": "vwf-core-29",
      "offset": 154956,
      "offsetHex": "0x00025D4C",
      "expected": 2428633088,
      "expectedHex": "0x90C20000",
      "replacement": 0,
      "replacementHex": "0x00000000"
    },
    {
      "group": "vwf-core",
      "name": "vwf-core-30",
      "offset": 154960,
      "offsetHex": "0x00025D50",
      "expected": 822673420,
      "expectedHex": "0x3109000C",
      "replacement": 837746691,
      "replacementHex": "0x31EF0003"
    },
    {
      "group": "vwf-core",
      "name": "vwf-core-31",
      "offset": 154964,
      "offsetHex": "0x00025D54",
      "expected": 608384,